{
  "$schema": "http://json-schema.org/draft-07/schema#",
  "title": "Ego Hygiene Pillars",
  "type": "array",
  "items": {
    "type": "object",
    "required": ["id", "slug", "title", "subtitle", "description", "domains", "aspects", "tags", "quote"],
    "properties": {
      "id": { "type": "integer" },
      "slug": { "type": "string" },
      "title": { "type": "string" },
      "subtitle": { "type": "string" },
      "description": { "type": "string" },
      "domains": {
        "type": "array",
        "items": { "type": "string" }
      },
      "aspects": {
        "type": "array",
        "items": { "type": "string" }
      },
      "tags": {
        "type": "array",
        "items": { "type": "string" }
      },
      "quote": { "type": "string" },
      "image": { "type": "string" }
    }
  }
}
